{
  "schemaVersion": "1.0.0",
  "captureId": "husaynia-20260816T064216Z",
  "capturedAtUtc": "2026-08-16T06:42:16.0995276+00:00",
  "sourceBaseUrl": "https://www.husaynia.org/",
  "routes": [
    {
      "routeId": "route-8a5edab282632443",
      "legacyPath": "/",
      "canonicalPath": "/",
      "expectedStatus": 200,
      "templateKey": "home",
      "contentKey": "content-8a5edab282632443",
      "indexable": true,
      "sitemap": false,
      "metadataKey": "metadata-8a5edab282632443",
      "assetKeys": [
        "asset-002f4f08e5d0ac3c",
        "asset-023217bce9599fc9",
        "asset-03b732bca99311a0",
        "asset-050c5be3a0d6e69a",
        "asset-059401fa2b98b28f",
        "asset-0685d31ea0e0d9fa",
        "asset-0689518515b9031e",
        "asset-069894c39bfa9632",
        "asset-08350f986ad02f8b",
        "asset-09780aa59e70f1f4",
        "asset-0a904d2c465027a4",
        "asset-0acedde71d1f640d",
        "asset-0c35e61a85cc0a92",
        "asset-0ccf72464e6287d6",
        "asset-0e60edb47d2161e4",
        "asset-0eb002debf996ef9",
        "asset-10ca66051a2a1c85",
        "asset-11ee76b1236715be",
        "asset-14449b6d573601c5",
        "asset-148b2100ba899f2d",
        "asset-14b0ca290be2d75e",
        "asset-16efeb77b2643884",
        "asset-17f9d60e1715a80f",
        "asset-1a7bcd612b42cef6",
        "asset-20a84e0bf41ec804",
        "asset-20ce99d330c564f4",
        "asset-218217c5d9c665d6",
        "asset-249113122fbae9a7",
        "asset-25cc3c98a5287e45",
        "asset-27754a13811bf9d3",
        "asset-27853971709cc013",
        "asset-280ee7db7e4154e0",
        "asset-28ed9bcfb3035a96",
        "asset-2df4ba390e533cc1",
        "asset-2e771248054d5910",
        "asset-313922c23888904d",
        "asset-36ef7fd3f8c3f422",
        "asset-36f71952d63cafe4",
        "asset-38eb41d0496f5764",
        "asset-3930b5ce60199c05",
        "asset-3a52637ad30d5b09",
        "asset-3a782a21801a549d",
        "asset-3f82037e23fda62d",
        "asset-406d0c27bd20d926",
        "asset-411477b63beaffbd",
        "asset-42b27bedf50d7a58",
        "asset-44e5344fdbec7e0f",
        "asset-45fbef1d82184de3",
        "asset-491f684baa98bd2b",
        "asset-4bae5b054129ad77",
        "asset-50bf8f2f65cb1af1",
        "asset-556d5b27f23bc02d",
        "asset-581e6b718685df9f",
        "asset-58a825ec541476a4",
        "asset-5b9d2fd841bf3715",
        "asset-5d45c2dfe6eef955",
        "asset-5d7cc972ec5719f5",
        "asset-61860eb4de5bf6db",
        "asset-625b54e38b8ff7d2",
        "asset-6459ee0453a4c666",
        "asset-660b0ac08b6bce2a",
        "asset-697be33d8aac110a",
        "asset-6a67da6ad2c15f64",
        "asset-6bcab9084e017648",
        "asset-72823a2f5ab8b5ce",
        "asset-7316074f56fa07cd",
        "asset-73f389ab4ee3e3b5",
        "asset-758b6c536300d59b",
        "asset-7591eb5ed2b08deb",
        "asset-75deb23ac281915d",
        "asset-763115cda0bdfc36",
        "asset-784668cb80071169",
        "asset-7b0ab09e806d80a6",
        "asset-7d7f160248c0a224",
        "asset-80acd2aa2d5a5e27",
        "asset-8242e937568a7031",
        "asset-85d6f2e8e5d79b0c",
        "asset-88cbb925d83c0b79",
        "asset-88e787a1b5388015",
        "asset-8bb976892ea493fb",
        "asset-8d163df5cebe03f0",
        "asset-8eb780052dcfe69c",
        "asset-90ab407714bd5883",
        "asset-943e259d7fe75ff9",
        "asset-94c52a889ccbca4c",
        "asset-960eef48a2e2d118",
        "asset-973498063a7769bf",
        "asset-984ddebd4286a144",
        "asset-9b0b10c3ae04cc2d",
        "asset-9d5e08d2f7e3c390",
        "asset-9d6ebf47c6ef528c",
        "asset-9f02aba82c3983f6",
        "asset-9f5ce53b5af1c973",
        "asset-a0bddd36ea2b085f",
        "asset-a10de77ca0adbd3e",
        "asset-a1e247f68ad5873d",
        "asset-a392db1c01e8ed4b",
        "asset-a4ea8a42ee3d7e19",
        "asset-aa218332a0784563",
        "asset-abe53a268f3cbd4f",
        "asset-ad00d7da47749ba7",
        "asset-addac1870af9fca6",
        "asset-b04d771a669aa8f8",
        "asset-b2af2ce85a7d7c5a",
        "asset-b342976e3bc4bc06",
        "asset-b43dba8b75bcd1d4",
        "asset-b5ae8f9332e0a1fd",
        "asset-b63a09f370a3e7db",
        "asset-b7515e48f1c69ff7",
        "asset-b81d090684934c34",
        "asset-b84e253eb79a9f83",
        "asset-b9b65e1e2c157958",
        "asset-b9de63277e86e8f9",
        "asset-ba8c3b26eddc0190",
        "asset-bb0acd9f89379c75",
        "asset-bda5a3baa433bcbc",
        "asset-be45e3e71a505480",
        "asset-bfe3dc2b115e9337",
        "asset-c098181f31d7f094",
        "asset-c0b24beef14def60",
        "asset-c411e854958e5308",
        "asset-c457b89c4a0a67a0",
        "asset-c5182411b1a68ef3",
        "asset-c5d4ca4b623df07a",
        "asset-c5fcdec8598a71d4",
        "asset-c699430078cbf3c4",
        "asset-c73efcaa268a535f",
        "asset-c981c6ba92ad9476",
        "asset-cc0873b8683b9856",
        "asset-cc8118773d717277",
        "asset-ccc678bcb8210538",
        "asset-cf6b03bf9215229f",
        "asset-d339f9834cf5396e",
        "asset-d4d7e07861b0b89a",
        "asset-d5fde7c8b7d55259",
        "asset-daf338e7bbcbba6f",
        "asset-dcb5cfe754218194",
        "asset-dd32ef4a1e6eb2bb",
        "asset-e090e698ceecbf92",
        "asset-e248b67794d1a540",
        "asset-e5929a8bc610ab28",
        "asset-e61e0d94bd9afb34",
        "asset-e631672cca3f2034",
        "asset-e6a245fbacd1f316",
        "asset-e72ce1179a525020",
        "asset-e9faeb523c0574de",
        "asset-eadfd8cfcf05f734",
        "asset-ebbec36508a062fb",
        "asset-ec01ce787a03eeb3",
        "asset-eee7ee4130227656",
        "asset-f02b3588c224db56",
        "asset-f055b0a2d9e02309",
        "asset-f84c7b70febc615a",
        "asset-f87ca5bbcd8f057e",
        "asset-fc94c721b6fa36ec",
        "asset-fd0add39d1cb96e5",
        "asset-fd868562b9c65ef3"
      ],
      "dynamicRegionKeys": [
        "dynamic-07fbd5ffab231fa0",
        "dynamic-1701a1ef716c23b2",
        "dynamic-175b412fada2260c",
        "dynamic-26cb50f1dddea2f6",
        "dynamic-2dd85e26266e28cd",
        "dynamic-3bf02d72fe1cbf6c",
        "dynamic-4375a765ded0adb3",
        "dynamic-4bd3bb223bd39db2",
        "dynamic-5a06f154fa4f6e96",
        "dynamic-65115e636320d372",
        "dynamic-67ee0a400804a2ff",
        "dynamic-84c68770e0eae071",
        "dynamic-910a8f7f5e1169b0",
        "dynamic-930062d7c38134af",
        "dynamic-95893747b19c6ff4",
        "dynamic-a9445f5fa1c3fd3e",
        "dynamic-af0338bb6feb74ea",
        "dynamic-bd8ebfc5ba5dd64a",
        "dynamic-be8195283a8beafc",
        "dynamic-bfd785382897848a",
        "dynamic-cfd921c15d93b5b9",
        "dynamic-ec649b82c4f610f7",
        "dynamic-ee0a1bd8feebe361"
      ],
      "evidenceRefs": [
        "raw/html/home.html",
        "http-inventory.json",
        "metadata-inventory.json"
      ],
      "contentChecksum": "e1e63a20bb6a849120a58b2ea5b06a08e1888f684caa8aedf63b8e623056dcee"
    },
    {
      "routeId": "route-0cb1a94fa1ca5c2d",
      "legacyPath": "/events/",
      "canonicalPath": "/events/",
      "expectedStatus": 200,
      "templateKey": "content-page",
      "indexable": true,
      "sitemap": false,
      "assetKeys": [],
      "dynamicRegionKeys": [],
      "evidenceRefs": [
        "http-inventory.json",
        "capture-summary.json"
      ]
    },
    {
      "routeId": "route-fc39fd6bcca9f87b",
      "legacyPath": "/feed/",
      "canonicalPath": "/feed/",
      "expectedStatus": 200,
      "templateKey": "content-page",
      "indexable": true,
      "sitemap": false,
      "assetKeys": [],
      "dynamicRegionKeys": [],
      "evidenceRefs": [
        "http-inventory.json",
        "capture-summary.json"
      ]
    },
    {
      "routeId": "route-b82370ba2acca69a",
      "legacyPath": "/page-sitemap.xml",
      "canonicalPath": "/page-sitemap.xml",
      "expectedStatus": 200,
      "templateKey": "machine-feed",
      "indexable": true,
      "sitemap": true,
      "assetKeys": [],
      "dynamicRegionKeys": [],
      "evidenceRefs": [
        "http-inventory.json",
        "capture-summary.json"
      ]
    },
    {
      "routeId": "route-0e424091fd258930",
      "legacyPath": "/post-archive-sitemap.xml",
      "canonicalPath": "/post-archive-sitemap.xml",
      "expectedStatus": 200,
      "templateKey": "machine-feed",
      "contentKey": "content-0e424091fd258930",
      "indexable": true,
      "sitemap": true,
      "assetKeys": [],
      "dynamicRegionKeys": [],
      "evidenceRefs": [
        "raw/endpoints/post-archive-sitemap.xml.xml",
        "http-inventory.json",
        "capture-summary.json"
      ],
      "contentChecksum": "30d1e273caf54df1e1e1293b14da7994a108a189c052892b7d97517fc99a1698"
    },
    {
      "routeId": "route-6eb5b70f5c28f406",
      "legacyPath": "/post-sitemap.xml",
      "canonicalPath": "/post-sitemap.xml",
      "expectedStatus": 200,
      "templateKey": "machine-feed",
      "contentKey": "content-6eb5b70f5c28f406",
      "indexable": true,
      "sitemap": true,
      "assetKeys": [],
      "dynamicRegionKeys": [],
      "evidenceRefs": [
        "raw/endpoints/post-sitemap.xml.xml",
        "http-inventory.json",
        "capture-summary.json"
      ],
      "contentChecksum": "80616f7db66ac03c125f8d9e30fc3a739eff2960f6be6b54574ec265a65d3cd6"
    },
    {
      "routeId": "route-adada1317532a28b",
      "legacyPath": "/robots.txt",
      "canonicalPath": "/robots.txt",
      "expectedStatus": 200,
      "templateKey": "content-page",
      "contentKey": "content-adada1317532a28b",
      "indexable": true,
      "sitemap": false,
      "assetKeys": [],
      "dynamicRegionKeys": [],
      "evidenceRefs": [
        "raw/endpoints/robots.txt.bin",
        "http-inventory.json",
        "capture-summary.json"
      ],
      "contentChecksum": "c33ad6ad65e49a2aa4131ff546147511fcf01f9204bd61614534569f428afc88"
    },
    {
      "routeId": "route-7efd2a819481844e",
      "legacyPath": "/sitemap.xml",